Sample,baseMean,log2FoldChange,lfcSE,stat,pvalue,padj
PWY0-845: superpathway of pyridoxal 5'-phosphate biosynthesis and salvage,14729517.779064763,-0.39931370528235327,0.8080141138119821,-0.49419149796592554,0.621170943603211,0.9264967732335971
PWY0-862: (5Z)-dodecenoate biosynthesis I,30443845.016255945,-0.16718062674368034,0.15302591173875127,-1.0924988117639467,0.2746139124659456,0.6159742619895863
PWY1G-0: mycothiol biosynthesis,411416.39385590266,0.22065377210772436,2.581097733399877,0.08548834445609098,0.9318731613260696,0.9924736115198807
PWY1ZNC-1: assimilatory sulfate reduction IV,333863.75578005373,0.2221291910100906,2.347057853038751,0.0946415490877221,0.9245995465334702,0.9921782509312653
PWY3O-4107: NAD salvage pathway V (PNC V cycle),7846269.643875782,1.1474346746877324,1.122642454584054,1.022083807718517,0.30674123621303784,0.6561418496477565
PWY490-3: nitrate reduction VI (assimilatory),1942.5193638913133,-43.2808512266689,0.0,0.0,,
PWY4FS-7: phosphatidylglycerol biosynthesis I (plastidic),32622137.33255286,-0.17880334974841597,0.1163233982757841,-1.537122817926123,0.12426323622228014,0.4134876944789838
PWY4FS-8: phosphatidylglycerol biosynthesis II (non-plastidic),31731945.552508414,-0.1558005415107997,0.11902315264187753,-1.3089935701802464,0.19053652876067062,0.5398534981552334
PWY4LZ-257: superpathway of fermentation (Chlamydomonas reinhardtii),4295139.1684461115,0.10984311452755276,0.7992341541254997,0.13743546113559185,0.8906866030436874,0.9876365610151501
PWY66-367: ketogenesis,3476.2558059628404,19.572469782802365,0.0,0.0,,
PWY66-388: ceramide degradation by &alpha;-oxidation,17193.20535254817,-16.88820543182688,0.0,0.0,,
PWY66-389: phytol degradation,7659688.985331066,-0.8016077991815007,1.1664032530546937,-0.6872475681820759,0.49192673324252145,0.852165830525382
PWY66-399: gluconeogenesis III,17125557.211687107,0.2962622884669452,0.17050610292172166,1.7375465358149524,0.08229074743147215,0.36410837562144527
PWY66-409: superpathway of purine nucleotide salvage,20541988.90756256,0.8039145228740573,0.8431875624118006,0.9534231275596509,0.34037572798951865,0.6914550952239907
PWY66-429: fatty acid biosynthesis initiation (mitochondria),47940689.467174426,-0.004508168211419275,0.06301968955649143,-0.07153586828411955,0.9429712789057845,0.9924736115198807
PYRIDNUCSAL-PWY: NAD salvage pathway I (PNC VI cycle),5523827.564854604,0.21963454102722568,1.3488271359572397,0.16283372062451484,0.8706493573683984,0.9876365610151501
PYRIDNUCSYN-PWY: NAD de novo biosynthesis I (from aspartate),17790157.513413418,-0.1654028653646317,0.1777340660026883,-0.9306199373288964,0.35205019759301515,0.6998588065111065
PYRIDOXSYN-PWY: pyridoxal 5'-phosphate biosynthesis I,14353786.274194282,-0.7500869608335571,0.8340253665816332,-0.8993574906574974,0.36846227406732956,0.7148365141172899
REDCITCYC: TCA cycle VI (Helicobacter),2742492.392569058,0.495914779497875,1.072291255798303,0.4624814170742021,0.6437361254758058,0.9432064338033443
RHAMCAT-PWY: L-rhamnose degradation I,1939996.8437724847,0.48337832166918177,1.0935877925465027,0.44201144614425364,0.6584809231604529,0.9505218587141869
RIBOSYN2-PWY: flavin biosynthesis I (bacteria and plants),35345091.9558852,-0.10785887939779003,0.10846746294279754,-0.9943892525141069,0.32003339844774636,0.6756260633896868
SALVADEHYPOX-PWY: adenosine nucleotides degradation II,2370775.081920502,0.9496288439283367,1.556377164947233,0.6101534160972687,0.5417601849944124,0.8932595262550553
SER-GLYSYN-PWY: superpathway of L-serine and glycine biosynthesis I,28950831.590161335,-0.07450877810888354,0.12138704806291463,-0.613811599325373,0.5393398314018398,0.8932595262550553
SO4ASSIM-PWY: assimilatory sulfate reduction I,7829614.835009731,-1.0504967076276766,0.4746140221503633,-2.213370567662805,0.0268721080922174,0.2169922728446555
SULFATE-CYS-PWY: superpathway of sulfate assimilation and cysteine biosynthesis,10866154.35298143,-0.72488221583708,0.3928738587467524,-1.8450762240822471,0.0650264512790129,0.3231314425095564
TCA-GLYOX-BYPASS: superpathway of glyoxylate bypass and TCA,175052.95271441014,25.455544808367954,6.212231301979034,4.097649229554374,4.173670969032541e-05,0.0026961914459950214
TCA: TCA cycle I (prokaryotic),947829.3319508887,2.4856271641061656,2.885375797869816,0.8614569949402181,0.38898639697333837,0.7311637273096024
THISYN-PWY: superpathway of thiamine diphosphate biosynthesis I,2449354.789047415,1.0032944962723227,2.4545838275864695,0.4087432195211833,0.6827281129348808,0.9560082180676649
THISYNARA-PWY: superpathway of thiamine diphosphate biosynthesis III (eukaryotes),20010627.648473993,-0.11076380911848738,0.10600718352267537,-1.0448707855236485,0.29608269372229223,0.6379971442086033
THRESYN-PWY: superpathway of L-threonine biosynthesis,43756079.093602754,0.03292686972485121,0.038000256755635335,0.8664907170651748,0.3862211148506892,0.7311637273096024
TRNA-CHARGING-PWY: tRNA charging,58968332.96458473,0.07395565177991545,0.0651194858698327,1.1356915797484237,0.25608566582978154,0.5906820998644529
TRPSYN-PWY: L-tryptophan biosynthesis,44474959.76082101,0.055706273676409734,0.09734745003940255,0.5722417346716524,0.567158216898636,0.8946996187929064
UDPNACETYLGALSYN-PWY: UDP-N-acetyl-D-glucosamine biosynthesis II,785902.424197062,0.023087442534872302,1.9322544663464163,0.011948448269614796,0.9904667444371952,0.9966378768012898
UDPNAGSYN-PWY: UDP-N-acetyl-D-glucosamine biosynthesis I,48613881.25379239,-0.013893343703414994,0.06743646812355666,-0.2060212239757233,0.836774332585398,0.9876365610151501
VALSYN-PWY: L-valine biosynthesis,48588614.86752518,0.11504166617883418,0.06540470822030517,1.7589202568007025,0.07859105400033774,0.35256820058484845
